Симптоми,Диагноза,Предотвратяване,Лекар
"Запушен нос, Хрема, Температура, Възпалено гърло, Лош дъх, Главоболие",Хроничен синузит,"Физиологични назални спрейове, Кортикостероидни назални спрейове, Деконгестанти, Болкоуспокоителни",Отоларинголог
"Параноя, Чуване на гласове, Илюзии, Виждане на образи, Халюцинации, Разстройство на мисълта, Липса на емоционалност, Тревожност, Проблеми със съня, Трудно заспиване, Раздразнителност, Объркване, Агресивност",Шизофрения,"Анти-психотични лекарства, Антидепресанти, Психотерапия, Обучение за придобиване и развитие на социални умения",Психиатър
"Бледа кожа, Студена кожа, Изпотена кожа, Ниско кръвно налягане, Тревожност, Болка в гърдите, Болка в корема, Жажда, Сухота в устата, Мускулна слабост",Шок,"Повикване на Бърза Помощ",Анестезиолог
"Зачервяване в очите, Подуване в очите, Сърбеж в очите, Парене в очите, Усещането че нещо е заседнало в окото, Прекомерно сълзене, Повишена чувствителност към светлина, Образуване на твърди корички по клепачите след ставане от сън, Замъглено зрение",Блефарит,"Влажни, топли компреси; антибиотични кремове или таблетки.",Офталмолог
"Вагинален сърбеж, Бяло вагинално течение, Подуване на вулвата, Болка при полов акт",Вагилната гъбична инфекци,"Кремове, Супозитории, Таблетки",Гинеколог
"Обрив, Мехури по кожата, Подути лимфни възли, Температура, Втрисане, Загуба на апетит, Главоболие, Болки в гърлото",Варицела,"Ваксина",Инфекционист
"Отичане на глезените, Отичане в долната част на краката, Болки, Крампи, Сърбеж, Изтръпване, Слаби крака, Язви, Зачервявания по краката, Зачервявания по глезените, Варикозни вени",Венозната недостатъчност,"Поддръжащи чорапогащници, Лекарства за кръвонасядания, Тренировка, Повдигане на крака, Процедури за премахване на увредените вени, Операция",Флеболог
"Болки в гърлото, Болка при преглъщане, Увеличени шийни лимфни възли, Увеличени субмандибуларни лимфни възли, Втрисане с понижена температура, Мускулни болки, Главоболие",Вирусният фарингит,"Антибиотик",Отоларинголог
"Силно главоболие, Объркване, Раздразнителност, Умора, Слабост, Чувствителност към светлината, Висока температура, Схванат врат, Припадъци, Обрив",Гръбначен менингит,"Антибиотици",Невролог
"Остра болка в предната част на гърдите",Остеохондритът,"Прилагане на топлина, лед, Противовъзпалителни лекарства",Ортопед
"Болка в горната част на корема, Спазми в горната част на кореа",Гастрит,"Диета, Антиациди, Н2 - блокери, Инхибитори на протонната помпа, Избягване на консумацията на алкохол и тютюнопушене, Избягване на медикаменти, които дразнят стомаха, Антибиотици",Гастроентеролог
"Подуване, Кървене от венците при допир или спонтанно",Гингивита,"Миенето на зъбите поне два пъти на ден, Жабуркането на устната кухина поне веднъж дневно, Редовно посещение при зъболекар за професионално почистване, Ядене на здравословни храни, Въздържание от тютюнопушене",Стоматолог
"Загуба на периферното зрение",Глаукомата,"Капки и медикаменти за понижаване на вътреочното налягане, Лазерно лечение за дрениране на течността от окото, Хирургично лечение.",Офталмолог
"Жълтеникава кожа, Жълт оттенък на бялото на очите",Жълтеницата при новородените,"По-чести и по-големи хранения",Неонатолог
"Зачервени очи, Чести кръвоизливи от носа, Ниско кръвно налягане, Забавен сърдечен ритъм, Замаяност, Неориентираност, Недостиг на въздух, Запек, Гадене",Наркотична зависимост,"Строги лечебни програми в лечебни заведения с ограничен достъп",Психиатър
"Чувство на глад, Умора, Силна жажда, Прием на големи количества течности, Често уриниране, Уриниране през нощта, Уриниране на повече от нормалното количество урина, Замъглено зрение, Загуба на телесно тегло",Захарнен диабет тип 1,"Инсулин, ACE-инхибитори, Статини и фибрати, Профилактична доза антиагреганти.",Ендокринолог
"Болка от двете страни на кръста, Мътна урина, Кървава урина, Нужда от често уриниране, Парещо уриниране, Гадене, Повръщане, Висока температура, Тръпки",Камъни в бъбреците,"Прием на много вода Болкоуспокояващи АнтибиотициИнтравенозни течности Медикаменти за гадене и възпаление Екстракорпорална литотрипсия Уретроскоп за премахване на камъка Операция Промяна в начина на живот за предотвратяване на рецидив Медикаменти за предотвратяване на рецидив",Уролог
"Тежка кашлица, Хрема, Кихане, Висока температура",Коклюш,"Антибиотици",Педиатър
"Диария, Коремни болки, Коремни спазми, Запек, Гадене след хранене, Повръщане след хранене, Кръв в изпражненията, Кръв в повърнатите материи, Загуба на тегло, Жълтеница, Желязодефицитна анемия",Рак на тънките черва,"Хирургично отстраняване на тумора, Лъчелечение",Онколог
"Смптоми на настинка, Запушен нос, Течащ нос, Гъст секрет в носа, Дишане през устата, Хъркане, Намалено чувство за вкус, Намалено обоняние",Назални полипи,"Носните кортикостероидни спрейове, перорални кортикостероиди, кортикостероидни инжекци, имунотерапия, хирургично премахване на полипи.",Отоларинголог
"Сърцебиене, Чувство за прескачане на сърцето, Чувство на страх, Безпокойство, Световъртеж, Болка в гърдите, Задух, Отпадналост, Слабост, Припадък",Нарушен в сърдечния ритъм,"Медикаменти за спиране на аритмията, Имплантиране на водач  на сърдечния ритъм, Електрокардиоверзио, Аблационна терапия",Кардиолог
"Отпадналост, Замаяност",Ниско кръвно налягане,"Смяна на медикаментите, Венозно приложение на течност, Лечение на основното заболяване",Кардиолог
"Треперене, Тревожност, Чувство на глад, Бледа кожа, Изпотена кожа, Настръхване на космите, Болки в стомаха, Унесеност",Ниска кръвна захар,"Прием на въглехидратипреоценка на антидиабетната терапияпромяна в диетаталечение на друго основно заболяване, което води до хипогликеми",Ендокринолог
"Персистираща кашлица,Недостиг на въздух, Гръдна болка, Изкашляне на кръв, Ръждиви храчки, Загуба на апетит, Загуба на тегло, Лесна уморяемост",Рак на белия дроб,"Оперативно отстраняване на тумора, химиотерапия, радиотерапия, таргетна терапия",Онколог
"Недобро храносмилане, Гадене, Липса на апетит, Чувство на подутост, Стомашен дискомфорт, Стомашна болка, Гадене, Повръщане, Трудно преглъщане",Рак на стомаха,"Операция за отстраняване на рака заедно с част или целия стомах.Интравенозна или перорална химиотерапия, която убива или забавя растежа на ракови клетки, особено когато ракът се е разпространил.",Онколог
"Болка в ставите, Подуване на ставите, Умора, Подуване на лимфни възли, Загуба на тегло, Сутрешна скованост, Зачервяване на ръце",Ревматоиден артрит,"Кортикостероиди, Биологични агенти, Противовъзпалителни лекарства, Физическа терапия, Хирургия",Ревматолог
"Зачервяване на лицето, Малки линии от спукани кръвоносни съдове, Задебелена кожа, Раздразнена кожа, Щипеща кожа, Зачервени очи",Розацея,"Избягване на причинители; Орални или локални антибиотици за акне-подобните симптоми; Други лекарства като изоретинол.",Дерматолог
"Анемия, Лесна умора, Жълтеница, Изоставане в растежа при децата, Уголемена слезка, Задух, Потъмняване на урината, Деформация на лицевия череп при новородени",Таласемия,"Хемотрансфузия, Лекарства захващащи желязато от организма с цел изхвърлянето му навън от кръвта",Хематолог
"Скованост в челюстта,Скованост на шията, Затруднено дишане, Затруднено преглъщане, Скованост в мускулите на корема, Спазми на цялата мускулатура",Тетанус,"Почистване и обработка на раната, Ваксинация, Реимунизация, Орални или интравенозни антибиотици, Тетаничен антитоксин (ТАП), за да неутрализира невротоксина",Инфекционист
"Кървене от носа, Кървене от венците, Лесно нараняване, Образуване на хематоми, Поява на червени петна по кожата",Тромбоцитопения,"Спиране и промяна на медикаментите довели до тромбоцитопения, Кръвопреливане, Кортикостероиди, Лекарства за потискане на имунната система",Хематолог
"Упорита кашлица, Отделяне на кръв при кашляне, Болка в гърдите, Нощно изпотяване, Температура, Втрисане, Умора, Загуба на апетит, Загуба на тегло",Туберкулоза,"Необходимост от провеждане на комбинирана терапия с най-малко две туберкулозни лекарства с цел избягване на развитието на резистентност, продължителност на терапията не по-малка от 6 месеца, с което се предотвратява екзацербация и рецидив на заболяването",Пулмолог
"Зачервяване, Дразнене, Сърбеж, Болка в краката, Подуване на вените на краката, Подуване на ръцете",Флебит,"Прием на антибиотици, ако има инфекция, Антикоагулантни средства като варфарин и хепарин, които разграждат кръвните съсиреци и предотвратяват образуването на нови.",Флеболог
"Болка, Чувствителност, Подуване, Посиняване на китката, Деформиране на китката",Счупена китка,"Носенето на шина или гипсиране, Лед, Повдигане.",Ортопед
"Двигателни нарушения, Сетивни нарушения, Зрителна недостатъчност, Очедвигателна непълноценност, Кривоглетство, Епилептичните прпадъци",Церебрална парализа,"Физиотерапия, Речева терапия, Трудова терапия, Ходене с помощни средства, Слухови апарати, Очила Специално образование",Невролог
"Висока температура, Гадене, Повръщане, Коремни болки, Силно главоболие, Гърчове, Задух, Кашлица с кървави храчки, Подуване на лимфните възли, Припадъци, Кървене на кожата, Нагнояване на кожата, Замъглено съзнание, Кестабилна походка",Чума,"Лечението е болнично",Инфекционист
"Слабост, Умора, Загуба на апетит, Гадене, Повръщане, Коремна болка, Подуване на корема, Зле-миришещи изпражнения, Жълтеникава кожа",Цироза на черният дроб,"Ако алкохол причинява вашия цирозата, най-важното нещо, което можете да направите е да се прекрати пиенето, Избягвайте лекарства, които могат да бъдат токсични за черния дроб, включително лекарства без рецепта.",Хепатолог
"Зачервени очи, Болка в окото, Изтичане на гной от окото, Замъглено виждане, Подути клепачи, Необичайно кръгло петно на повърхността на окото",Язва на роговицата на окото,"Антибиотични капки",Офталмолог
"Недостиг на въздух, Учестено дишане, Болка в гърдите, Болка в челюстта, Болка в рамото, Болка в ръката, Кашлица, Плюене на кръв, Тревожност, Безпокойство, Замаяност, Сърцебиене",Белодробна емболия,"Консултация с лекар.",Пулмолог
"Задух, Суха кашлица, Умора, Слабост, Трудност при активност, Посиняване на кожата около устата или ноктите",Белодробна фиброза,"Консултация с лекар.",Пулмолог
"Диария, Крампи, Стомашна болка, Висока температура, Кървене от ректума, Кървави изпражнения, Загуба на апетит, Необяснима загуба на тегло, Умора, Болки в ставите, Отоци, Отекли очи, Рани по устата, Рани по кожата, Проблеми с черния дроб",Болест на Крон,"Консултация с лекар.",Гастроентеролог
"Прием на огромни количества храна, Страх от увеличаване на телесното тегло, Натрапливо желание за отслабване, Силно чувство за вина след хранене",Булимия,"Консултация с лекар.",Психиатър
"Затруднено дишане, Необичаен звук от гърдите при вдишване, Кашлица, Висока температура, Кръв в храчките",Бронхиален аденом,"Консултация с лекар.",Пулмолог
"Висока температура, Възпалено гърло, Кихане, Болки в синусите, Хрема, Главоболие, Мускулни болки, Кашлица, Умора",Грип,"Консултация с лекар.",Общопрактикуващ 

